{
  "$schema": "https://rmside.invalid/schemas/texture-palettes/v1",
  "schemaVersion": "1.0.0",
  "compatibility": { "minimumMajor": 1, "maximumMajor": 1 },
  "profileId": "aoe2de-101.103.57257-rms-v1",
  "derivationContract": "aoe2de-texture-average-palette-v1",
  "entries": [
    {
      "paletteId": "aoe2de-101.103.57257.0-texture-colors-v1",
      "productVersion": "101.103.57257.0",
      "source": "installation-texture-averages",
      "provenance": {
        "tool": "rms-cli export-texture-averages + tools/derive-texture-palette.mjs",
        "installationBuild": "101.103.57257.0",
        "derivedOn": "2026-10-28"
      },
      "terrainColors": [
        { "terrainId": 0, "color": 8557120 },
        { "terrainId": 1, "color": 2193570 },
        { "terrainId": 2, "color": 13743499 },
        { "terrainId": 3, "color": 10720079 },
        { "terrainId": 4, "color": 4756349 },
        { "terrainId": 5, "color": 10123066 },
        { "terrainId": 6, "color": 14064476 },
        { "terrainId": 7, "color": 7367215 },
        { "terrainId": 8, "color": 12092490 },
        { "terrainId": 9, "color": 9145413 },
        { "terrainId": 10, "color": 10123066 },
        { "terrainId": 11, "color": 12691552 },
        { "terrainId": 12, "color": 8165954 },
        { "terrainId": 13, "color": 14529661 },
        { "terrainId": 14, "color": 14529661 },
        { "terrainId": 15, "color": 2193570 },
        { "terrainId": 16, "color": 8557120 },
        { "terrainId": 17, "color": 10123066 },
        { "terrainId": 18, "color": 10123066 },
        { "terrainId": 19, "color": 10123066 },
        { "terrainId": 20, "color": 10123066 },
        { "terrainId": 21, "color": 10986381 },
        { "terrainId": 22, "color": 1786732 },
        { "terrainId": 23, "color": 1659519 },
        { "terrainId": 24, "color": 11772808 },
        { "terrainId": 25, "color": 11243116 },
        { "terrainId": 26, "color": 8825535 },
        { "terrainId": 27, "color": 12691552 },
        { "terrainId": 28, "color": 2193570 },
        { "terrainId": 29, "color": 10975041 },
        { "terrainId": 30, "color": 10384446 },
        { "terrainId": 31, "color": 9531706 },
        { "terrainId": 32, "color": 11849179 },
        { "terrainId": 33, "color": 12497319 },
        { "terrainId": 34, "color": 10529435 },
        { "terrainId": 35, "color": 8169671 },
        { "terrainId": 36, "color": 12891549 },
        { "terrainId": 37, "color": 11256569 },
        { "terrainId": 38, "color": 11249574 },
        { "terrainId": 39, "color": 9468759 },
        { "terrainId": 40, "color": 9668460 },
        { "terrainId": 41, "color": 13145687 },
        { "terrainId": 42, "color": 12421195 },
        { "terrainId": 43, "color": 10454632 },
        { "terrainId": 44, "color": 8484938 },
        { "terrainId": 45, "color": 13410915 },
        { "terrainId": 46, "color": 13544056 },
        { "terrainId": 47, "color": 0 },
        { "terrainId": 48, "color": 14064476 },
        { "terrainId": 49, "color": 12421195 },
        { "terrainId": 50, "color": 13145687 },
        { "terrainId": 51, "color": 13351064 },
        { "terrainId": 52, "color": 12297081 },
        { "terrainId": 53, "color": 13810848 },
        { "terrainId": 54, "color": 5544075 },
        { "terrainId": 55, "color": 5544075 },
        { "terrainId": 56, "color": 6843178 },
        { "terrainId": 57, "color": 1455706 },
        { "terrainId": 58, "color": 1153448 },
        { "terrainId": 59, "color": 7778719 },
        { "terrainId": 60, "color": 7047473 },
        { "terrainId": 61, "color": 7107393 },
        { "terrainId": 62, "color": 7763260 },
        { "terrainId": 63, "color": 6320709 },
        { "terrainId": 64, "color": 9865309 },
        { "terrainId": 65, "color": 9272659 },
        { "terrainId": 66, "color": 8813137 },
        { "terrainId": 67, "color": 8157262 },
        { "terrainId": 68, "color": 7965243 },
        { "terrainId": 69, "color": 0 },
        { "terrainId": 70, "color": 9996663 },
        { "terrainId": 71, "color": 10057272 },
        { "terrainId": 72, "color": 10986381 },
        { "terrainId": 73, "color": 11849179 },
        { "terrainId": 74, "color": 11849179 },
        { "terrainId": 75, "color": 7831101 },
        { "terrainId": 76, "color": 9531718 },
        { "terrainId": 77, "color": 6843178 },
        { "terrainId": 78, "color": 9931127 },
        { "terrainId": 79, "color": 13743499 },
        { "terrainId": 80, "color": 10651495 },
        { "terrainId": 81, "color": 7826269 },
        { "terrainId": 82, "color": 6576968 },
        { "terrainId": 83, "color": 7047473 },
        { "terrainId": 84, "color": 1118481 },
        { "terrainId": 85, "color": 1118481 },
        { "terrainId": 86, "color": 1118481 },
        { "terrainId": 87, "color": 1118481 },
        { "terrainId": 88, "color": 10123066 },
        { "terrainId": 89, "color": 10123066 },
        { "terrainId": 90, "color": 4756349 },
        { "terrainId": 91, "color": 10651495 },
        { "terrainId": 92, "color": 10123066 },
        { "terrainId": 93, "color": 1118481 },
        { "terrainId": 94, "color": 1118481 },
        { "terrainId": 95, "color": 5472331 },
        { "terrainId": 96, "color": 8349497 },
        { "terrainId": 97, "color": 1118481 },
        { "terrainId": 98, "color": 1118481 },
        { "terrainId": 99, "color": 1118481 },
        { "terrainId": 100, "color": 10455620 },
        { "terrainId": 101, "color": 8293718 },
        { "terrainId": 102, "color": 11309421 },
        { "terrainId": 103, "color": 10191718 },
        { "terrainId": 104, "color": 10123066 },
        { "terrainId": 105, "color": 10986381 },
        { "terrainId": 106, "color": 10986381 },
        { "terrainId": 107, "color": 10651495 },
        { "terrainId": 108, "color": 7826269 },
        { "terrainId": 109, "color": 6576968 },
        { "terrainId": 110, "color": 10123066 },
        { "terrainId": 111, "color": 6579512 },
        { "terrainId": 112, "color": 8165954 },
        { "terrainId": 113, "color": 6843178 },
        { "terrainId": 114, "color": 9601085 },
        { "terrainId": 115, "color": 7827521 },
        { "terrainId": 116, "color": 9795130 },
        { "terrainId": 117, "color": 8289336 },
        { "terrainId": 118, "color": 13341013 },
        { "terrainId": 119, "color": 10847809 },
        { "terrainId": 120, "color": 10454080 },
        { "terrainId": 121, "color": 9994814 },
        { "terrainId": 122, "color": 7440186 },
        { "terrainId": 123, "color": 8359228 },
        { "terrainId": 124, "color": 10664907 },
        { "terrainId": 125, "color": 10664907 },
        { "terrainId": 126, "color": 10664907 },
        { "terrainId": 127, "color": 9810372 },
        { "terrainId": 128, "color": 10123066 },
        { "terrainId": 129, "color": 0 },
        { "terrainId": 130, "color": 4745576 },
        { "terrainId": 131, "color": 10123066 },
        { "terrainId": 132, "color": 10986381 },
        { "terrainId": 133, "color": 10123066 }
      ],
      "objectColors": [
        { "objectId": 1, "color": 4932668 },
        { "objectId": 2, "color": 7234909 },
        { "objectId": 3, "color": 7429452 },
        { "objectId": 4, "color": 6707017 },
        { "objectId": 5, "color": 6446166 },
        { "objectId": 6, "color": 5722186 },
        { "objectId": 7, "color": 4932154 },
        { "objectId": 8, "color": 5852484 },
        { "objectId": 10, "color": 6048049 },
        { "objectId": 11, "color": 4998196 },
        { "objectId": 12, "color": 5852731 },
        { "objectId": 13, "color": 5129013 },
        { "objectId": 14, "color": 6048049 },
        { "objectId": 15, "color": 5590337 },
        { "objectId": 16, "color": 6970440 },
        { "objectId": 17, "color": 6312256 },
        { "objectId": 18, "color": 6179636 },
        { "objectId": 19, "color": 6179636 },
        { "objectId": 20, "color": 5589046 },
        { "objectId": 21, "color": 6312254 },
        { "objectId": 23, "color": 7099708 },
        { "objectId": 24, "color": 6115651 },
        { "objectId": 25, "color": 5723732 },
        { "objectId": 26, "color": 7233614 },
        { "objectId": 27, "color": 6773062 },
        { "objectId": 28, "color": 6575950 },
        { "objectId": 30, "color": 6050887 },
        { "objectId": 31, "color": 6050887 },
        { "objectId": 32, "color": 6050887 },
        { "objectId": 33, "color": 4933440 },
        { "objectId": 34, "color": 6179646 },
        { "objectId": 35, "color": 7692360 },
        { "objectId": 36, "color": 5589565 },
        { "objectId": 37, "color": 6838861 },
        { "objectId": 38, "color": 6117458 },
        { "objectId": 39, "color": 5326141 },
        { "objectId": 40, "color": 5919557 },
        { "objectId": 41, "color": 6051145 },
        { "objectId": 42, "color": 7362363 },
        { "objectId": 43, "color": 8346688 },
        { "objectId": 44, "color": 7890002 },
        { "objectId": 45, "color": 8153420 },
        { "objectId": 46, "color": 6907492 },
        { "objectId": 47, "color": 6639674 },
        { "objectId": 48, "color": 4798760 },
        { "objectId": 49, "color": 6639414 },
        { "objectId": 51, "color": 6639674 },
        { "objectId": 52, "color": 6973799 },
        { "objectId": 53, "color": 6776645 },
        { "objectId": 54, "color": 5985097 },
        { "objectId": 56, "color": 5588539 },
        { "objectId": 57, "color": 6183508 },
        { "objectId": 58, "color": 7363661 },
        { "objectId": 59, "color": 4146460 },
        { "objectId": 60, "color": 5656134 },
        { "objectId": 61, "color": 4671060 },
        { "objectId": 62, "color": 8946039 },
        { "objectId": 63, "color": 5922653 },
        { "objectId": 64, "color": 5461587 },
        { "objectId": 65, "color": 7625028 },
        { "objectId": 66, "color": 10388050 },
        { "objectId": 67, "color": 5988447 },
        { "objectId": 68, "color": 8152389 },